TESTCASE ID,Tên testcase(Mục đích),Các bước thực hiện ,Kết quả mong muốn,Độ ưu tiên,Kết quả thực tế ,Trạng thái,Ghi chú,Dev,Unnamed: 9
UC_01 Đăng nhập với vai trò Tasker,,,,,,,,,
TC_T01_001,Kiểm tra màn hình đăng nhập của Tasker hiển thị,"1. Mở app Chị Ơi!
2. Màn hình đăng nhập
3. Quan sát màn hình ","Màn hình đăng nhập hiển thị Thông tin
- Nhập Số điện thoại
- Nhập mật khẩu 
- Quên mật khẩu
- Đăng nhập
- Đăng ký tasker 
Tiếp tục đăng nhập với Tk
+ Google
+ Facebook
Hiện thị 
+ Điều khoản 
+ Bảo mật",,,Pass,,,
TC_T01_002,Kiểm tra đăng nhập thành công với tài khoản hợp lệ,"1. Mở app Chị Ơi! 
 2. Chọn tab Tasker 
 3. Nhập SĐT hợp lệ 
 4. Nhập mật khẩu đúng 
 5. Nhấn “Đăng nhập”",Điều hướng vào M16 – Trang chủ Tasker,High,Hệ thống đăng nhập thành công và hiển thị màn hình trang chủ của tasker ,Pass,,,
TC_T01_003,Kiểm tra đăng nhập khi sai mật khẩu,"1. Mở màn hình login 
 2. Chọn tab Tasker 
 3. Nhập SĐT đúng 
 4. Nhập mật khẩu sai 
 5. Nhấn “Đăng nhập”",Hiển thị lỗi “Sai số điện thoại hoặc mật khẩu”,High,"Hệ thống hiển thị lỗi ""Phiên đăng nhập hết hạn. Vui lòng đăng nhập lại""",Fail,,Dev-Completed,
TC_T01_004,Kiểm tra validate khi bỏ trống số điện thoại,"1. Chọn tab Tasker 
 2. Để trống SĐT 
 3. Nhập mật khẩu 
 4. Nhấn “Đăng nhập”",Hiển thị “Vui lòng nhập số điện thoại”,Medium,"Hệ thống hiển thị thông báo "" Vui lòng đăng nhập SDT và mật khẩu"" ",Pass,,,
TC_T01_005,Kiểm tra định dạng số điện thoại không hợp lệ,"1. Nhập SĐT sai format 
 2. Nhập password 
 3. Nhấn “Đăng nhập”",Hệ thống tự chặn khi nhập sai định dạng và Hiển thị “Số điện thoại không hợp lệ”,Medium,"Hệ thống hiển thị thông báo "" Phiên đăng nhập hết hạn. Vui lòng đăng nhập lại"" ",Fail,,Dev-Completed,
TC_T01_006,Kiểm tra validate khi bỏ trống mật khẩu,"1. Nhập SĐT hợp lệ 
 2. Để trống mật khẩu 
 3. Nhấn “Đăng nhập”",Hiển thị “Vui lòng nhập mật khẩu”,Medium,"Hệ thống hiển thị thông báo "" Vui lòng đăng nhập SDT và mật khẩu"" ",Pass,,,
TC_T01_007,Kiểm tra validate khi bỏ trống toàn bộ field,"1. Không nhập dữ liệu 
 2. Nhấn “Đăng nhập”",Hiển thị validate cho cả 2 field,Medium,"Hệ thống hiển thị thông báo "" Vui lòng đăng nhập SDT và mật khẩu"" ",Pass,,,
TC_T01_008,Kiểm tra trim khoảng trắng đầu/cuối số điện thoại,"1. Nhập “ 0901234567 ” 
 2. Nhập password đúng 
 3. Nhấn login",Hệ thống chặn không cho nhập khoảng trắng,Medium,Hệ thống đăng nhập thành công,Fail,,,
TC_T01_009,Kiểm tra password phân biệt hoa thường,"1. Nhập đúng SĐT 
 2. Nhập password sai chữ hoa/thường 
 3. Login",Đăng nhập thất bại,High,,Not Run,,Dev-Completed,
TC_T01_010,Kiểm tra nhập khoảng trắng đầu cuối password,"1. Nhập đúng Số điện thoại
2. Nhập khoảng trắng đầu cuối mật khẩu",Chặn không cho phép nhập,Medium,Hệ thống đang cho phép nhập,Fail,,Dev-Completed,
TC_T01_011,Kiểm tra submit form bằng phím Enter,"1. Nhập đúng thông tin 
 2. Nhấn Enter",Hệ thống thực hiện login,Low,Hệ thống đăng nhập thành công ,Pass,,,
TC_T01_012,Kiểm tra chức năng ẩn/hiện mật khẩu,"1. Nhập password 
 2. Nhấn icon mắt 
 3. Nhấn lại icon mắt",Password hiển thị/ẩn đúng,Low,"Hệ thống hiển thị đúng password, kích chuột để ẩn/ hiển mật khẩu",Pass,,,
TC_T01_013,Kiểm tra link “Quên mật khẩu”,"1. Mở màn hình login 
 2. Nhấn “Quên mật khẩu”",Điều hướng sang M03,High,"Hệ thống hiển thị màn hình ""Quên mật khẩu"" ",Pass,,,
TC_T01_014,Kiểm tra link “Đăng ký Tasker”,"1. Chọn tab Tasker 
 2. Nhấn “Đăng ký Tasker”",Điều hướng sang màn hình đăng ký,Medium,"Hệ thống hiển thị màn hình ""Đăng kí"" ",Pass,,,
TC_T01_015,Kiểm tra login khi mất kết nối mạng,"1. Tắt Internet 
 2. Nhập thông tin hợp lệ 
 3. Nhấn login",Hiển thị “Không có kết nối mạng”,High,"Hệ thống hiển thị thông báo "" failed to fetch""",Fail,,Dev-Completed,
TC_T01_016,Kiểm tra spam nút đăng nhập,"1. Nhập dữ liệu đúng 
 2. Nhấn liên tục nút login",Chỉ gửi 1 request login,Medium,Hệ thống đăng nhập thành công và hiển thị màn hình trang chủ tasker,Pass,,,
TC_T01_017,Kiểm tra lưu session đăng nhập,"1. Login thành công 
 2. Tắt app 
 3. Mở lại app",Người dùng vẫn đăng nhập,High,,Not Run,,Dev-Completed,
TC_T01_018,Kiểm tra giới hạn ký tự mật khẩu,1. Nhập password vượt giới hạn,"Không cho nhập vượt max length "" Nhập tối đa từ 8-20 Ký tự""",Low,Hệ thống không giới hạn các ký tự ,Fail,,Dev-Completed,
TC_T01_019,Kiểm tra tài khoản không tồn tại,"1. Nhập SĐT chưa đăng ký 
 2. Nhập password bất kỳ 
 3. Login",Hiển thị lỗi tài khoản không tồn tại,High,"Hệ thống hiện thị thôg báo ""Phiên đăng nhập hết hạn. Vui lòng đăng nhập lại""",Fail,,Dev-Completed,
TC_T01_020,Kiểm tra đăng nhập nhiều thiết bị,"1. Login trên thiết bị A 
 2. Login trên thiết bị B",Hệ thống xử lý đúng theo business,Medium,,Not Run,,Dev-Completed,
TC_T01_021,Kiểm tra copy/paste vào field password,"1. Copy password 
 2. Paste vào field password",Dữ liệu được nhập đúng,Low,Hệ thống dán đúng pass đã copy,Pass,,,
TC_T01_022,Kiểm tra keyboard mobile hiển thị đúng,1. Focus field SĐT,Hiển thị bàn phím số,Low,,Not Run,,Dev-Completed,đang làm tới đây
TC_T01_023,Kiểm tra bảo mật password,1. Nhập password,Password hiển thị dạng chấm/ẩn,High,,Pass,,,
TC_T01_024,Kiểm tra đăng xuất rồi login lại,"1. Login thành công 
 2. Logout 
 3. Login lại",Login thành công bình thường,Medium,,Pass,,,
TC_T01_025,"Kiểm tra đăng nhập bằng google, facebook,...","Màn hình đăng nhập 
1. Đăng nhập bằng google hoặc facebook
2. Quan sát màn hình ",Hệ thống đăng nhập thành công,High,Hệ thống chưa có dữ liệu,Fail,,,
TC_T01_026,Kiểm tra hệ thống khi nhấn điều khoản ,"Màn hình đăng nhập 
1. Nhấn điều khoản 
2. Quan sát màn hình ",Hệ thống hiển thị điều khoản của app,High,Hệ thống chưa có dữ liệu,Fail,,,
TC_T01_027,Kiểm tra hệ thống khi nhấn bảo mật,"Màn hình đăng nhập 
1. Nhấn bảo mật 
2. Quan sát màn hình  ",,Medium,Hệ thống chưa có dữ liệu,Fail,,,
TC_T01_028,Kiểm tra tài khoản chưa được duyệt,"1. Mở màn hình login 
 2. Chọn tab Tasker 
 3. Nhập tài khoản Pending 
 4. Nhập đúng password 
 5. Nhấn “Đăng nhập”",Hiển thị “Tài khoản đang chờ duyệt”,High,,Not Run,,,
TC_T01_029,Kiểm tra chuyển tab Customer → Tasker,"1. Mở login 
 2. Chọn tab Tasker",Form Tasker hiển thị đúng,Low,,,,,
TC_T01_030,Kiểm tra chống SQL Injection,"1. Nhập ' OR '1'='1 
 2. Nhấn login","Không đăng nhập được, không lỗi server",High,,,,,
TC_T01_031,Kiểm tra chống XSS,"1. Nhập <script>alert('xss')</script> 
 2. Nhấn login",Script không được thực thi,Medium,,,,,
TC_T01_032,Kiểm tra timeout API login,"1. Mô phỏng mạng chậm 
 2. Nhập dữ liệu đúng 
 3. Login",Hiển thị timeout/error phù hợp,Medium,,,,,
UC_02 Đăng ký trở thành Tasker,,,,,,,,,
TC_T02_001,Kiểm tra đăng ký Tasker thành công với dữ liệu hợp lệ,"1. Mở M01 
 2. Nhấn “Đăng ký Tasker” 
 3. Nhập họ tên hợp lệ 
 4. Số điện thoại
 5. Nhập CCCD 12 số hợp lệ 
 6. Mật khẩu
 7. Nhâpj lại 
 8. Đăng ký dịch vụ 
 9 . Gừi hồ sơ đăng ký",Hồ sơ được gửi thành công và hiển thị trạng thái chờ duyệt,High,Hệ thống đăng ký thành công và tasker đang chờ duyệt,Pass,,,
TC_T02_002,Kiểm tra điều hướng từ M01 sang màn hình đăng ký,"1. Mở M01 
 2. Nhấn “Đăng ký Tasker”",Điều hướng đúng sang M02,Medium,,Pass,,,
TC_T02_003,Kiểm tra validate khi bỏ trống họ tên,"1. Để trống họ tên 
 2. Nhập các field khác hợp lệ 
 3. Nhấn “Gửi đăng ký”",Hiển thị “Vui lòng nhập họ tên”,High,"Hệ thống hiển thị thông báo "" Vui lòng nhập đầy đủ thông tin bắt buộc""",Pass,,,
TC_T02_004,Kiểm tra validate khi bỏ trống CCCD,"1. Nhập họ tên 
 2. Để trống CCCD 
 3. Các trường khác nhập hợp lệ
 4. Nhấn gửi",Hiển thị “Vui lòng nhập CCCD”,High,"Hệ thống hiển thị thông báo "" Vui lòng nhập đầy đủ thông tin bắt buộc""",Pass,,,
TC_T02_005,Kiểm tra validate CCCD nhỏ hơn 12 số,"1. Nhập CCCD 10 hoặc 11 số 
 2. Nhấn gửi đăng ký",Hiển thị “CCCD không hợp lệ”,High,Hệ thống đăng ký thành công,Fail,TRƯỜNG ĐKI:  chỉ cho phép nhập SDT và mật khẩu. upload ảnh lên sẽ đọc cứng trường họ tên và CCCD,,
TC_T02_009,Kiểm tra validate khi chưa chọn dịch vụ,"1. Nhập đầy đủ thông tin 
 2. Không chọn dịch vụ 
 3. Nhấn gửi",Hiển thị “Vui lòng chọn ít nhất 1 dịch vụ”,High,Hệ thống đăng ký thành công,Fail,,,
TC_T02_010,Kiểm tra chọn 1 dịch vụ,"1. Chọn “Dọn nhà” 
 2. Gửi đăng ký",Hệ thống lưu đúng dịch vụ đã chọn,Medium,Hệ thống không hiển thị gói đã đăng ký ,Fail,,,
TC_T02_011,Kiểm tra chọn nhiều dịch vụ,"1. Chọn nhiều dịch vụ 
 2. Gửi đăng ký",Hệ thống lưu đầy đủ các dịch vụ,Medium,,,,,
TC_T02_012,Kiểm tra upload ảnh selfie + CCCD hợp lệ,"1. Nhấn icon camera 
 2. Upload ảnh rõ nét đúng định dạng",Ảnh upload thành công,High,,,,,
TC_T02_013,Kiểm tra upload ảnh sai định dạng,"1. Upload file .exe/.txt 
 2. Nhấn gửi",Hiển thị lỗi định dạng file,High,,,,,
TC_T02_014,Kiểm tra upload ảnh quá dung lượng,1. Upload ảnh vượt giới hạn size,Hiển thị lỗi dung lượng ảnh,Medium,,,,,
TC_T02_015,Kiểm tra upload ảnh mờ/không nhận diện được CCCD,"1. Upload ảnh bị mờ 
 2. Nhấn gửi",Hiển thị “Ảnh không đủ điều kiện”,High,,,,,
TC_T02_016,Kiểm tra upload ảnh thiếu CCCD,1. Upload selfie không có CCCD,Hệ thống yêu cầu upload lại,High,,,,,
TC_T02_017,Kiểm tra upload ảnh không có khuôn mặt,1. Upload ảnh chỉ có CCCD,Hiển thị lỗi xác minh ảnh,Medium,,,,,
TC_T02_018,Kiểm tra bỏ trống toàn bộ field,"1. Không nhập dữ liệu 
 2. Nhấn gửi đăng ký",Hiển thị validate tất cả field bắt buộc,Medium,,,,,
TC_T02_019,Kiểm tra trim khoảng trắng họ tên,"1. Nhập “ Nguyễn Văn A ” 
 2. Submit form",Hệ thống tự trim dữ liệu,Low,,,,,
TC_T02_020,Kiểm tra nhập họ tên có số,1. Nhập “Nguyễn Văn A123”,Hiển thị lỗi họ tên không hợp lệ,Medium,,,,,
TC_T02_021,Kiểm tra nhập họ tên có ký tự đặc biệt,1. Nhập “Nguyễn @ Văn A”,Hiển thị lỗi validate,Medium,,,,,
TC_T02_022,Kiểm tra giới hạn ký tự họ tên,1. Nhập họ tên vượt max length,Không cho nhập vượt giới hạn,Low,,,,,
TC_T02_023,Kiểm tra nút “Gửi đăng ký” khi thiếu dữ liệu,1. Không nhập đủ thông tin,Nút disabled hoặc validate đúng,Low,,,,,
TC_T02_024,Kiểm tra loading khi submit hồ sơ,"1. Nhập đủ dữ liệu 
 2. Nhấn gửi",Hiển thị loading trong lúc xử lý,Medium,,,,,
TC_T02_025,Kiểm tra spam nút “Gửi đăng ký”,1. Nhấn nhiều lần liên tục nút gửi,Chỉ tạo 1 hồ sơ đăng ký,Medium,,,,,
TC_T02_026,Kiểm tra timeout API đăng ký,"1. Giả lập mạng chậm 
 2. Submit hồ sơ",Hiển thị timeout phù hợp,Medium,,,,,
TC_T02_027,Kiểm tra mất mạng khi gửi đăng ký,"1. Tắt Internet 
 2. Submit form",Hiển thị lỗi kết nối mạng,High,,,,,
TC_T02_028,Kiểm tra đăng ký với CCCD đã tồn tại,"1. Nhập CCCD đã đăng ký 
 2. Submit form",Hiển thị “CCCD đã tồn tại”,High,,,,,
TC_T02_029,Kiểm tra chống XSS tại field họ tên,"1. Nhập <script>alert(1)</script> 
 2. Submit",Script không được thực thi,Medium,,,,,
TC_T02_030,Kiểm tra upload nhiều lần ảnh CCCD,"1. Upload ảnh lần 1 
 2. Upload lại ảnh khác",Ảnh mới được cập nhật,Low,,,,,
TC_T02_031,Kiểm tra preview ảnh sau upload,1. Upload ảnh CCCD,Hiển thị preview ảnh đúng,Low,,,,,
TC_T02_032,Kiểm tra xóa ảnh đã upload,"1. Upload ảnh 
 2. Nhấn xóa ảnh",Ảnh bị remove khỏi form,Low,,,,,
TC_T02_033,Kiểm tra giữ dữ liệu khi submit lỗi,1. Submit form thiếu field,Các dữ liệu đã nhập vẫn được giữ,Medium,,,,,
TC_T02_034,Kiểm tra keyboard số tại field CCCD trên mobile,1. Focus field CCCD,Hiển thị bàn phím số,Low,,,,,
TC_T02_035,Kiểm tra thứ tự tab/focus field,1. Nhấn Tab trên keyboard,Focus di chuyển đúng thứ tự field,Low,,,,,
TC_T02_036,Kiểm tra khả năng copy/paste CCCD,"1. Copy CCCD 
 2. Paste vào field",Dữ liệu được nhập đúng,Low,,,,,
TC_T02_037,Kiểm tra ký tự Unicode trong họ tên,1. Nhập tên tiếng Việt có dấu,Hệ thống lưu đúng Unicode,Medium,,,,,
TC_T02_038,Kiểm tra submit bằng phím Enter,"1. Nhập đầy đủ dữ liệu 
 2. Nhấn Enter",Form được submit đúng,Low,,,,,
TC_T02_039,Kiểm tra trạng thái hồ sơ sau đăng ký,"1. Đăng ký thành công 
 2. Kiểm tra hồ sơ",Trạng thái = Pending/Chờ duyệt,High,,,,,
UC_03 Quên mật khẩu / Đặt lại qua OTP,,,,,,,,,
TC_T03_001,Mở màn Quên mật khẩu,"1. Mở màn hình đăng nhập Tasker 
2. Nhấn “Quên mật khẩu?”",Hệ thống chuyển sang màn M03,High,,,,,
TC_T03_002,Gửi OTP thành công,"1. Nhập SĐT hợp lệ 
2. Nhấn “Gửi OTP”",OTP được gửi qua SMS và hiển thị màn nhập OTP,Medium,,,,,
TC_T03_003,Bỏ trống số điện thoại,"1. Để trống field SĐT 
2. Nhấn “Gửi OTP”",Hiển thị lỗi yêu cầu nhập số điện thoại,Medium,,,,,
TC_T03_004,Nhập SĐT sai định dạng,"1. Nhập ký tự chữ hoặc SĐT không đủ số 
2. Nhấn “Gửi OTP”",Hiển thị lỗi SĐT không hợp lệ,High,,,,,
TC_T03_005,SĐT chưa đăng ký,"1. Nhập SĐT chưa tồn tại
2. Nhấn “Gửi OTP”",Hiển thị “Tài khoản không tồn tại”,High,,,,,
TC_T03_006,Hiển thị màn nhập OTP,"1. Nhập SĐT hợp lệ 
2. Nhấn “Gửi OTP”",Hiển thị 6 ô nhập OTP,High,,,,,
TC_T03_007,Nhập OTP đúng,"1. Nhập đúng 6 số OTP 
2. Nhấn “Xác nhận”",OTP hợp lệ và chuyển sang màn đặt mật khẩu mới,Medium,,,,,
TC_T03_008,Nhập sai OTP,"1. Nhập OTP sai 
2. Nhấn “Xác nhận”",Hiển thị “OTP không chính xác”,Medium,,,,,
TC_T03_009,OTP hết hạn,"1. Chờ OTP hết hạn 
2. Nhập OTP 
3. Nhấn “Xác nhận”",Hiển thị “OTP đã hết hạn”,High,,,,,
TC_T03_010,Gửi lại OTP,"1. Chờ countdown 30s kết thúc 
2. Nhấn “Gửi lại OTP”",OTP mới được gửi thành công,Medium,,,,,
TC_T03_011,Không cho resend trước 30s,"1. Gửi OTP 
2. Nhấn “Gửi lại OTP” trước 30s",Nút resend bị disable hoặc không hoạt động,Medium,,,,,
TC_T03_012,Đặt mật khẩu mới thành công,"1. Nhập mật khẩu mới 
2. Nhập xác nhận mật khẩu
3. Nhấn “Lưu mật khẩu”",Hiển thị “Đặt lại mật khẩu thành công”,High,,,,,
TC_T03_013,Confirm password không khớp,"1. Nhập mật khẩu mới 
2. Nhập confirm password khác 
3. Nhấn lưu",Hiển thị lỗi mật khẩu không khớp,High,,,,,
TC_T03_014,Login bằng mật khẩu mới,"1. Quay lại màn login 
2. Nhập SĐT và mật khẩu mới 
3. Nhấn đăng nhập",Đăng nhập thành công,High,,,,,
TC_T03_015,Không login được bằng mật khẩu cũ,"1. Nhập SĐT 
2. Nhập mật khẩu cũ 
3. Nhấn đăng nhập",Hiển thị sai mật khẩu,High,,,,,
TC_T03_016,Mất internet khi gửi OTP,"1. Tắt kết nối mạng 
2. Nhập SĐT 
3. Nhấn “Gửi OTP”",Hiển thị lỗi kết nối mạng,Medium,,,,,
TC_T03_017,Server lỗi khi reset password,"1. Nhập OTP hợp lệ 
2. Nhập mật khẩu mới 
3. Nhấn lưu khi server lỗi",Hiển thị “Vui lòng thử lại sau”,Medium,,,,,
TC_T03_018,Double click không tạo duplicate request,"1. Nhập OTP đúng 
2. Double click nút “Xác nhận”",Hệ thống chỉ gửi 1 request,Medium,,,,,
TC_T03_019,Responsive UI,"1. Mở màn hình trên mobile/tablet 
2. Resize màn hình","UI hiển thị đúng, không vỡ layout",Low,,,,,
TC_T03_020,Bảo mật thông tin OTP,"1. Gửi OTP 
2. Kiểm tra response/API",Không hiển thị OTP hoặc dữ liệu nhạy cảm,High,,,,,
UC_04 Trạng thái Online / Offline,,,,,,,,,
TC_T04_001,Hiển thị trạng thái hiện tại của Tasker,"1. Đăng nhập vào M16 
2. Quan sát header",Hiển thị đúng trạng thái Online/Offline hiện tại,High,,,,,
TC_T04_002,Chuyển từ Online sang Offline,"1. Đang ở trạng thái Online 
2. Nhấn nút trạng thái trên header",Trạng thái chuyển sang Offline ngay lập tức,High,,,,,
TC_T04_003,Chuyển từ Offline sang Online,"1. Đang ở trạng thái Offline 
2. Nhấn nút trạng thái",Trạng thái chuyển sang Online thành công,High,,,,,
TC_T04_004,Hiển thị màu trạng thái đúng,1. Chuyển trạng thái Online/Offline,"Online hiển thị chấm xanh, Offline hiển thị đúng màu thiết kế",Medium,,,,,
TC_T04_005,Cập nhật trạng thái realtime,"1. Chuyển trạng thái 
2. Refresh trang",Trạng thái vẫn được giữ đúng,High,,,,,
TC_T04_006,Không nhận đơn mới khi Offline,"1. Chuyển sang Offline 
2. Chờ hệ thống phân đơn",Không nhận đơn mới,Medium,,,,,
TC_T04_007,Nhận đơn khi Online,"1. Chuyển sang Online 
2. Chờ hệ thống phân đơn",Có thể nhận đơn mới,Medium,,,,,
TC_T04_008,Mất mạng khi chuyển trạng thái,"1. Tắt mạng 
2. Nhấn đổi trạng thái",Hiển thị lỗi cập nhật trạng thái thất bại,High,,,,,
TC_T04_009,Double click nút trạng thái,1. Double click nút Online/Offline,Hệ thống chỉ xử lý 1 request,Medium,,,,,
TC_T04_010,Loading khi cập nhật trạng thái,1. Nhấn đổi trạng thái,Hiển thị loading/spinner khi xử lý,Medium,,,,,
TC_T04_011,Không đổi trạng thái khi server lỗi,1. Nhấn đổi trạng thái khi server lỗi,Hiển thị “Vui lòng thử lại sau” và trạng thái không đổi,High,,,,,
TC_T04_012,Đồng bộ trạng thái giữa nhiều thiết bị,"1. Login cùng tài khoản trên 2 thiết bị 
2. Đổi trạng thái ở thiết bị A",Thiết bị B cập nhật trạng thái đúng,Medium,,,,,
TC_T04_013,Giữ trạng thái sau khi đăng nhập lại,"1. Chuyển Online 
2. Logout/Login lại",Hệ thống hiển thị đúng trạng thái trước đó,Medium,,,,,
TC_T04_014,Không cho truy cập chức năng khi chưa login,"1. Chưa đăng nhập 
2. Truy cập M16",Redirect về màn login,Medium,,,,,
TC_T04_015,Responsive UI nút trạng thái,1. Mở trên mobile/tablet,Nút trạng thái hiển thị đúng UI,Low,,,,,
TC_T04_016,Kiểm tra tốc độ cập nhật trạng thái,1. Nhấn đổi trạng thái,Trạng thái cập nhật trong thời gian cho phép,Medium,,,,,
TC_T04_017,Ghi log thay đổi trạng thái,1. Đổi Online/Offline,Hệ thống lưu log thay đổi trạng thái,Medium,,,,,
TC_T04_018,Không expose lỗi hệ thống,1. Trigger API error khi đổi trạng thái,Không hiển thị SQL/API detail,High,,,,,
TC_T04_019,API cập nhật trạng thái trả đúng mã,1. Gửi request đổi trạng thái,Response trả đúng status code,Medium,,,,,
TC_T04_020,Spam click đổi trạng thái liên tục,1. Nhấn đổi trạng thái liên tục nhiều lần,"Hệ thống xử lý ổn định, không crash",Medium,,,,,
UC_05 Xem đơn mới,,,,,,,,,
TC_T05_001,Kiểm tra hiển thị đơn mới khi Tasker Online,"1. Đăng nhập Tasker 
 2. Chuyển trạng thái Online 
 3. Chờ hệ thống đẩy đơn mới",Đơn mới hiển thị trong mục “Đơn mới”,High,,,,,
TC_T05_002,Kiểm tra không nhận đơn khi Tasker Offline,"1. Chuyển trạng thái Offline 
 2. Chờ có đơn mới",Không hiển thị đơn mới,High,,,,,
TC_T05_003,Kiểm tra hiển thị tên dịch vụ,1. Có đơn mới được đẩy về,Hiển thị đúng tên dịch vụ (Dọn nhà/Trông trẻ/Mua hộ),High,,,,,
TC_T05_004,Kiểm tra hiển thị số giờ làm việc,1. Có đơn mới,Hiển thị đúng số giờ của đơn,Medium,,,,,
TC_T05_005,Kiểm tra hiển thị mức thu nhập,1. Có đơn mới,Hiển thị đúng thu nhập (+Xk),High,,,,,
TC_T05_006,Kiểm tra hiển thị khoảng cách địa lý,1. Có đơn mới,Hiển thị đúng khoảng cách (vd: 0.4km),Medium,,,,,
TC_T05_007,Kiểm tra hiển thị thời gian thực hiện,1. Có đơn mới,Hiển thị đúng thời gian thực hiện đơn,Medium,,,,,
TC_T05_008,Kiểm tra hiển thị đầy đủ thông tin đơn,1. Có đơn mới,"Hiển thị đầy đủ dịch vụ, giờ, thu nhập, khoảng cách, thời gian",High,,,,,
TC_T05_009,Kiểm tra nhận đơn thành công,"1. Có đơn mới 
 2. Nhấn “Nhận đơn”",Đơn được nhận thành công,High,,,,,
TC_T05_010,Kiểm tra bỏ qua đơn,"1. Có đơn mới 
 2. Nhấn “Bỏ qua”",Đơn bị ẩn hoặc chuyển trạng thái bỏ qua,Medium,,,,,
TC_T05_011,Kiểm tra trạng thái chờ khi không có đơn,"1. Tasker Online 
 2. Không có đơn phù hợp",Hiển thị trạng thái “Đang chờ đơn mới”,Medium,,,,,
TC_T05_012,Kiểm tra thông báo realtime khi có đơn mới,"1. Tasker Online 
 2. Hệ thống tạo đơn phù hợp",Hiển thị notification/popup đơn mới realtime,High,,,,,
TC_T05_013,Kiểm tra âm thanh thông báo đơn mới,1. Có đơn mới được gửi,Phát âm thanh thông báo,Low,,,,,
TC_T05_014,Kiểm tra rung thiết bị khi có đơn mới trên mobile,1. Có đơn mới,Thiết bị rung thông báo,Low,,,,,
TC_T05_015,Kiểm tra nhiều đơn mới cùng lúc,1. Hệ thống gửi nhiều đơn,"Danh sách đơn hiển thị đúng, không trùng",High,,,,,
TC_T05_016,Kiểm tra thứ tự hiển thị đơn mới,1. Có nhiều đơn mới,Đơn mới nhất hiển thị trên cùng,Medium,,,,,
TC_T05_017,Kiểm tra tự động refresh danh sách đơn,"1. Tasker đang online 
 2. Có đơn mới",Danh sách cập nhật realtime không cần reload,Medium,,,,,
TC_T05_018,Kiểm tra đơn hết hạn,1. Chờ đơn quá thời gian nhận,Đơn tự biến mất hoặc disabled,Medium,,,,,
TC_T05_019,Kiểm tra nhận đơn đã bị người khác nhận,"1. Tasker A và B cùng thấy đơn 
 2. Tasker A nhận trước 
 3. Tasker B nhận sau",Tasker B nhận thông báo đơn đã được nhận,High,,,,,
TC_T05_020,Kiểm tra loading khi nhận đơn,1. Nhấn “Nhận đơn”,Hiển thị loading trong lúc xử lý,Low,,,,,
TC_T05_021,Kiểm tra spam nút “Nhận đơn”,1. Nhấn nhiều lần nút nhận đơn,Chỉ gửi 1 request nhận đơn,Medium,,,,,
TC_T05_022,Kiểm tra spam nút “Bỏ qua”,1. Nhấn nhiều lần nút bỏ qua,Chỉ xử lý 1 request,Low,,,,,
TC_T05_023,Kiểm tra mất mạng khi nhận đơn,"1. Có đơn mới 
 2. Tắt mạng 
 3. Nhấn nhận đơn",Hiển thị lỗi kết nối mạng,High,,,,,
TC_T05_024,Kiểm tra timeout API nhận đơn,"1. Mô phỏng mạng chậm 
 2. Nhấn nhận đơn",Hiển thị timeout phù hợp,Medium,,,,,
TC_T05_025,Kiểm tra chuyển trạng thái Online/Offline realtime,"1. Đang Online 
 2. Chuyển Offline",Ngừng nhận đơn mới ngay lập tức,Medium,,,,,
TC_T05_026,Kiểm tra đơn không phù hợp không hiển thị,"1. Tasker chỉ nhận Dọn nhà 
 2. Hệ thống tạo đơn Trông trẻ",Không hiển thị đơn không phù hợp,High,,,,,
TC_T05_027,Kiểm tra khoảng cách làm tròn đúng format,1. Có đơn khoảng cách thực tế,Hiển thị đúng format km,Low,,,,,
TC_T05_028,Kiểm tra định dạng thu nhập,1. Có đơn mới,Thu nhập hiển thị đúng format (+100k),Low,,,,,
TC_T05_029,Kiểm tra scroll danh sách nhiều đơn,1. Có nhiều đơn mới,"Scroll mượt, không vỡ UI",Medium,,,,,
TC_T05_030,Kiểm tra UI responsive trên mobile,1. Mở app trên nhiều kích thước màn hình,UI hiển thị đúng,Medium,,,,,
TC_T05_031,Kiểm tra giữ trạng thái danh sách đơn sau refresh app,"1. Có danh sách đơn 
 2. Refresh app",Danh sách được load lại đúng,Medium,,,,,
TC_T05_032,Kiểm tra hiển thị icon/trạng thái đơn mới,1. Có đơn mới,Đơn có badge/tag “Mới”,Low,,,,,
